	_id	articles	bij_link	bij_summary_short	bureau_id	children	civilians	country	date	deaths	deaths_max	deaths_min	injuries	lat	location	lon	names	narrative	number	target	town	tweet_id	bins
309	55c79e721cbee48856a309bb	[]	http://www.thebureauinvestigates.com/2011/08/10/obama-2011-strikes/	4-5 killed and 2 injured in strike on 10th anniversary of 9-11. Hisokhel, North Waziristan.	Ob239	0	0	Pakistan	2011-09-11	4-5	5	4	2	32.953944	North Waziristan	70.262883	[]	A CIA drone destroyed a car, killing 4-5 people.	310		Hisokhel	301524798041894912	1
310	55c79e721cbee48856a309bc	[]	http://www.thebureauinvestigates.com/2012/03/29/yemen-reported-us-covert-actions-since-2001/	There were two alleged US drone strikes reported on this day, killing 4 and up to 7, respectively.	YEM029	0	0	Yemen	2011-09-21	4	4	4	0	14.037484	Abyan Province	46.768075	[]	In the first of 2 airstrikes, US drones killed 4 people. Their target, Saeed al-Shehri, escaped.	311	Saeed al-Shehri	Al-Mahfad	301524900450009088	0
311	55c79e721cbee48856a309bd	[]	http://www.thebureauinvestigates.com/2012/03/29/yemen-reported-us-covert-actions-since-2001/	A second strike reportedly targeted militants in the southern port city of Shaqra, killing up to seven people.	YEM030	0	0	Yemen	2011-09-21	6-7	7	6	3	13.358082	Abyan Province	45.698439	[]	In the second air strike of the day, 7 people were killed.	312		Shaqra	301524967026216961	1
312	55c79e721cbee48856a309be	[]	http://www.thebureauinvestigates.com/2011/08/10/obama-2011-strikes/	3-8 alleged militants killed and 3-4 injured in strike on house and vehicle. Khushali, North Waziristan.	Ob240	0	0	Pakistan	2011-09-23	3-8	8	3	4	32.96863543	North Waziristan	70.35301208	[]	Two US drone missiles hit a house in the village of Khushali Turikhel, killing 6 people.	313		Khushali	301525016590286849	1
313	55c79e721cbee48856a309bf	[]	http://www.thebureauinvestigates.com/2012/02/22/get-the-data-somalias-hidden-war/	The United States launched a series of drone attacks on al-Shabaab in Kismayo, according to residents, who reported attacks on three locations.	SOM013	0	0	Somalia	2011-09-25	Unknown	0	0	0	-0.354098	Lower Juba	42.545328	[]	US drones attacked the port city of Kismayo. Residents reported 'explosions around the city.'	314		Kismayo	301525050341855235	0
314	55c79e721cbee48856a309c0	[]	http://www.thebureauinvestigates.com/2011/08/10/obama-2011-strikes/	Up to four killed and up to two injured in strike on a compound. Azam Warsak, South Waziristan.	Ob241	0	0	Pakistan	2011-09-27	0-4	4	0	2	32.30222379	South Waziristan	69.40544128	[]	A US drone fired 2 missiles at a vehicle in Azam Warsak, narrowly missing the people inside.	315		Azam Warsak	301525090154213376	1
315	55c79e721cbee48856a309c1	[]	http://www.thebureauinvestigates.com/2011/08/10/obama-2011-strikes/	3-4 killed and 5 injured in strike on a vehicle. Baghar, South Waziristan.	Ob242	0	0	Pakistan	2011-09-30	3-4	4	3	5	32.30280417	South Waziristan	69.32510376	[]	A suspected US drone killed 3 people in a car.	316		Baghar	301525130205609985	1
316	55c79e721cbee48856a309c2	[]	http://www.thebureauinvestigates.com/2012/03/29/yemen-reported-us-covert-actions-since-2001/	Anwar al-Awlaki, the US-born cleric, became the first US citizen to be deliberately killed by the CIA in a drone strike. 3 others were killed as well.	YEM031	0	0	Yemen	2011-09-30	4	4	4	0	16.565146	Al Jawf Province	45.538211	[Anwar al Awlaki, Samir Khan, Abu Muhsen al Maribi, Salem al Marwani]	Two US citizens--Anwar al-Awlaki and Samir Khan--were killed by US drones.	317			301525604535238656	0
317	55c79e721cbee48856a309c3	[]	http://www.thebureauinvestigates.com/2012/02/22/get-the-data-somalias-hidden-war/	Four Somali farmers were reported to have been killed in a possible drone strike in Dolbiyow Village, 35km east of Dhobley. The farmers and their camels were killed moments after al-Shabaab fighters fled the area in vehicles, witnesses said.	SOM014	0	4	Somalia	2011-10-06	4	4	4	1	-0.117925	Dolbiyow	42.326611	[]	A suspected US drone fired two missiles, killing 4 farmers and 'at least 10 camels.'	318			301526286399049728	1
318	55c79e721cbee48856a309c4	[]	http://www.thebureauinvestigates.com/2011/08/10/obama-2011-strikes/	4-6 killed and 4 injured. Danda Darpakhel, North Waziristan.	Ob243	0	0	Pakistan	2011-10-13	4-6	6	4	4	33.020179	North Waziristan	70.07286072	[]	On Thursday, the first of two drone strikes killed 4-6 people in North Waziristan.	319		Danda Darpakhel	301527137750482945	1
319	55c79e721cbee48856a309c5	[]	http://www.thebureauinvestigates.com/2011/08/10/obama-2011-strikes/	3-6 killed in strike on a compound. Zeba Pahar, South Waziristan.	Ob244	0	0	Pakistan	2011-10-13	3-6	6	3	3	32.4784877	South Waziristan	69.27841187	[]	Hours later, missiles hit a house and car in South Waziristan, killing 6 people.	320		Zeba Pahar	301527258147999744	1
320	55c79e721cbee48856a309c6	[]	http://www.thebureauinvestigates.com/2012/03/29/yemen-reported-us-covert-actions-since-2001/	In the first of several attacks on this day, a drone attack struck a house in the Azan district of Shabwah, but the occupants of the house had left two minutes earlier.	YEM033	0	0	Yemen	2011-10-14	0	0	0	0	14.33936309	Shabwah Province	47.44163168	[]	In the first of several attacks on the day, a US drone struck a house in Azan.	321		Azan	301527780741500928	0
321	55c79e721cbee48856a309c7	[]	http://www.thebureauinvestigates.com/2011/08/10/obama-2011-strikes/	5-6 alleged militants killed in strike on a vehicle. Danda Darpakhel, North Waziristan.	Ob245	0	0	Pakistan	2011-10-14	5-6	6	5	0	33.020179	North Waziristan	70.07286072	[]	Three men stood near a car, talking. CIA missiles took their lives from above.	322		Danda Darpakhel	301529955081265152	0
322	55c79e721cbee48856a309c8	[]	http://www.thebureauinvestigates.com/2012/03/29/yemen-reported-us-covert-actions-since-2001/	Drone strike killed 7-9 people, including a 16 and 17-year-old boy. Abdulrahman al-Awlaki, the 16-year old son of Anwar al-Awlaki, was one of the people who perished.	YEM034	2	2	Yemen	2011-10-14	7-9	9	7	0	14.323499	Shabwah Province	47.453653	[Abdulrahman al-Awlaki, Ahmed Abdulrahman al-Awlaki, Sarhan al-Qusa]	While eating dinner with his teenage cousins, Abdulrahman, a 16-year-old US citizen, was killed by a US drone.	323		Azan	301530264406982656	0
323	55c79e721cbee48856a309c9	[]	http://www.thebureauinvestigates.com/2012/03/29/yemen-reported-us-covert-actions-since-2001/	A third possible drone attack killed up to 17 people on Friday night.	YEM035	0	0	Yemen	2011-10-14	15-17	17	15	0	13.612304	Unknown	46.106282	[]	A third possible drone attack killed up to 17 people on Friday night.	324			302875163488296960	0
324	55c79e721cbee48856a309ca	[]	http://www.thebureauinvestigates.com/2012/03/29/yemen-reported-us-covert-actions-since-2001/	Saleh Qaid Toayman and his 14-year-old son were reported killed in an overnight strike in Azan. They were grazing camels 'in an area known to be controlled by al-Qaida,' and had then slept by a mosque, according to Toayman's 15-year-old son Azzedine who survived the strike.	YEM036	1	1-2	Yemen	2011-10-14	2	2	2	0	14.33936309	Shabwah Province	47.44163168	[Saleh Qaid Toayman]	Azzedine, 15, was grazing camels. His father and brother, 14, were 'scattered into pieces.'	325		Azan	303515066047815680	0
325	55c79e721cbee48856a309cb	[]	http://www.thebureauinvestigates.com/2011/08/10/obama-2011-strikes/	3-6 killed and 3-7 injured in strike on a compound. Angor Adda, South Waziristan.	Ob246	0	0	Pakistan	2011-10-15	3-6	6	3	7	32.48659683	South Waziristan	69.28321838	[]	US drones fired eight missiles at a building in Baghar, killing 4 people and wounding 3 others.	326		Angor Adda	303894491826364416	2
326	55c79e721cbee48856a309cc	[]	http://www.thebureauinvestigates.com/2011/08/10/obama-2011-strikes/	There were reports of a further strike in South Waziristan on Maulvi Nazir's forces, which killed up to seven alleged militants. Three of those killed were named as Hazrat Ali, Sher Ali and Amir Hamza - possibly 'low level Taliban commanders.'	Ob246c	0	0	Pakistan	2011-10-15	3-7	7	3	3-6	32.327033	South Waziristan	69.596401	[]	3 people killed. Nine missiles. From the rubble, three bodies: Hazrat, Sher, Amir.	327		Baghar Chinah	304292122708803584	1
327	55c79e721cbee48856a309cd	[]	http://www.thebureauinvestigates.com/2012/02/22/get-the-data-somalias-hidden-war/	At least 11 civilians died and more than 20 others were wounded after a possible US drone attacked on Afmadow town in the Lower Juba region.	SOM016	0	11	Somalia	2011-10-23	11	11	11	20	-0.354098	Lower Juba	42.545328	[]	11 civilians killed and more than 20 wounded. Drones seen hovering for 'the last few days.'	328		Afmadow	304980441214107648	3
328	55c79e721cbee48856a309ce	[]	http://www.thebureauinvestigates.com/2011/08/10/obama-2011-strikes/	13-22 killed and 6 injured in a strike.	Ob247	0	0	Pakistan	2011-10-26	13-22	22	13	6	32.664167	South Waziristan	70.218333	[]	Two missiles struck the village of Bobar, killing between 13 and 22 people.	329		Bobar	306089666841571328	2
329	55c79e721cbee48856a309cf	[]	http://www.thebureauinvestigates.com/2011/08/10/obama-2011-strikes/	4-6 killed and 3-4 injured in a strike on a vehicle. Azam Warsak, South Waziristan.	Ob248	0	0	Pakistan	2011-10-27	4-6	6	4	4	32.30222379	South Waziristan	69.40544128	[]	Maulvi lived. But his 20-year-old brother, Hazrat, and cousin, Meraj, did not. 4-6 killed.	330		Azam Warsak	306125627835174912	1
330	55c79e721cbee48856a309d0	[]	http://www.thebureauinvestigates.com/2011/08/10/obama-2011-strikes/	A second strike of the day on either a moving vehicle or a house in North Waziristan killed 4-6 alleged militants, according to Pakistani security officials. No further details were given.	Ob249	0	0	Pakistan	2011-10-27	4-6	6	4	3	32.953944	North Waziristan	70.262883	[]	The second attack of the day killed 4 people in a house.	331		Hisokhel	306850829757976576	1
331	55c79e721cbee48856a309d1	[]	http://www.thebureauinvestigates.com/2011/08/10/obama-2011-strikes/	Strike on a vehicle killed 4-6.	Ob250	0	4	Pakistan	2011-10-30	4-6	6	4	2	33.151242	North Waziristan	70.434707	[]	3 chromite miners--Khastar, Mamrud, and Noorzal--were killed in a car. 4-6 dead, 2 injured.	332		Datta Khel	307547687224496130	1
332	55c79e721cbee48856a309d2	[]	http://www.thebureauinvestigates.com/2011/08/10/obama-2011-strikes/	An attack on a vehicle near the town of Mir Ali, North Waziristan killed 2-4 people, including at two civilians.	Ob251	0	2	Pakistan	2011-10-31	2-4	4	2	3	32.98879572	North Waziristan	70.32606125	[]	Tariq, 16, and Waheed, 12, were driving to pick up their aunt. A drone ended their journey.	333		Norak	308650659895468032	1
333	55c79e721cbee48856a309d3	[]	http://www.thebureauinvestigates.com/2011/08/10/obama-2011-strikes/	An attack on an alleged militant housing compound near Miranshah in North Waziristan killed up to three people and injured three others, according to local officials. Dawn reported that the casualties were part of the Haqqani Network.	Ob252	0	0	Pakistan	2011-11-03	2-3	3	2	3	33.020179	North Waziristan	70.07286072	[]	3 people killed in Darpakhel Sarai.	334		Danda Darpakhel	309358975600713728	1
334	55c79e721cbee48856a309d4	[]	http://www.thebureauinvestigates.com/2012/03/29/yemen-reported-us-covert-actions-since-2001/	The militant stronghold of Rumeila was targeted by 'five US drone strikes,' killing an unknown number of people.	YEM038	0	0	Yemen	2011-11-08	Unknown	0	0	0	13.612304	Abyan Province	46.106282	[]	Five US drone strikes' killed an unknown number of people in Rumeila.	335		Rumeila	309463189454716928	0
335	55c79e721cbee48856a309d5	[]	http://www.thebureauinvestigates.com/2012/02/22/get-the-data-somalias-hidden-war/	Missiles were fired at a training camp in Afgoye, Lower Shabelle, according to al Shabaab. 1-2 reported killed. Unclear who was responsible for the strikes.	SOM018	0	0	Somalia	2011-11-14	1-2	2	1	0	2.140976	Lower Shabelle	45.118861	[]	1-2 people were killed in the town of Afgoye.	336		Afgoye	310063000079982592	0
336	55c79e721cbee48856a309d6	[]	http://www.thebureauinvestigates.com/2011/08/10/obama-2011-strikes/	7 killed and 2-4 injured in strike on a house in Miranshah.	Ob253	0	0	Pakistan	2011-11-15	7	7	7	4	33.0020414	North Waziristan	70.06084442	[]	Nine people were sleeping. At 3:45am, a US drone fired missiles at their house, killing 7.	337		Miranshah	310066974149451777	1
337	55c79e721cbee48856a309d7	[]	http://www.thebureauinvestigates.com/2011/08/10/obama-2011-strikes/	16-22 killed in strike on two housing compounds in Babar Ghar.	Ob254	0	0	Pakistan	2011-11-16	16-22	22	16	6	32.620038	South Waziristan	69.976425	[]	Deep in the mountains, 15-22 people were killed by missiles from five US drones.	338		Babar Ghar	311179732555280384	2
338	55c79e721cbee48856a309d8	[]	http://www.thebureauinvestigates.com/2011/08/10/obama-2011-strikes/	In the third strike in as many days, CIA drones attacked a compound in North Waziristan, killing 7-9.	Ob255	0	0	Pakistan	2011-11-17	7-9	9	7	5	33.01873964	North Waziristan	69.65881348	[]	In Razmak, at least 4 people were killed when US drones fired missiles into a building.	339		Shawal	311219981868208128	1
339	55c79e721cbee48856a309d9	[]	http://www.thebureauinvestigates.com/2012/03/29/yemen-reported-us-covert-actions-since-2001/	A US drone strike reportedly killed Abdulrahman al-Wuhayshi, the younger brother of Nasser al-Wuhayshi, a Yemeni who leads AQAP.	YEM039	0	0	Yemen	2011-12-22	1	1	1	0	13.129616	Abyan Province	45.381295	[Abdulrahman al-Wuhayshi]	A US drone attacked the town of Zinjibar, killing one person.	340		Zinjibar	311254589766778881	0
340	55c79e721cbee48856a309da	[]	http://www.thebureauinvestigates.com/2012/01/11/obama-2012-strikes/	1-4 people killed in a strike on a house near Miranshah. Aslam Awan (aka Abdullah Khorasani), a senior operations operative for al Qaeda  is believed to be among dead.	Ob256	0	0	Pakistan	2012-01-10	1-4	4	1	2	33.0020414	North Waziristan	70.06084442	[]	Missiles destroyed a mudbrick house, killing 4. A mother and son, who were inside, survived.	341		Miranshah	311308465085759488	1
341	55c79e721cbee48856a309db	[]	http://www.thebureauinvestigates.com/2012/01/11/obama-2012-strikes/	5-9 alleged militants killed and 2-3 injured in a strike on two vehicles near Dogga.	Ob257	0	0	Pakistan	2012-01-12	5-9	9	5	3	33.151242	North Waziristan	70.434707	[]	A US drone killed at least 8 people Thursday.	342		Datta Khel	312280311952199681	1
342	55c79e721cbee48856a309dc	[]	http://www.thebureauinvestigates.com/2012/02/22/get-the-data-somalias-hidden-war/	Three missiles fired from a suspected drone operated by JSOC killed British-Lebanese militant Bilal Al-Barjawi, also known as Abu Hafsa.	SOM019	0	0	Somalia	2012-01-21	1	1	1	0	2.084754	Banaadir	45.210714	[Bilal Al-Barjawi]	Hours after his wife gave birth in a London hospital, 27-year-old Bilal was killed by a drone.	343		Elasha Biyaha	313675639041433600	0
343	55c79e721cbee48856a309dd	[]	http://www.thebureauinvestigates.com/2012/01/11/obama-2012-strikes/	4-5 alleged militants killed and 1 injured in a strike on a vehicle near Deegan.	Ob258	0	0	Pakistan	2012-01-23	4-5	5	4	1	32.96863543	North Waziristan	69.70207214	[]	Up to 5 people were driving when the missiles struck. Their vehicle was 'engulfed by fire.'	344		Deegan	314191848392495105	1
344	55c79e721cbee48856a309de	[]	http://www.thebureauinvestigates.com/2012/05/08/yemen-reported-us-covert-action-2012/	10-14 people killed in Abyan.	YEM040	0	0	Yemen	2012-01-31	10-14	14	10	0	13.880199	Abyan Province	45.86811	[Mouwhahhad al-Maaribi, Ibrahim Al-Najdi, Abed Al Farraj Al-Shamri, Saleh Al-Akili, Abdul Munim al-Fathani]	At least 13 people were killed from above.	345		Lawdar/Modya	314383105949593601	0
345	55c79e721cbee48856a309df	[]	http://www.thebureauinvestigates.com/2012/01/11/obama-2012-strikes/	9-10 alleged militants killed and up to 12 injured a strike on a house near Miranshah.	Ob260	0	0	Pakistan	2012-02-08	9-10	10	9	12	33.0020414	North Waziristan	70.06084442	[]	Drone missiles hit a house, killing 10. 'Almost all the men were burnt beyond recognition.'	346		Miranshah	314395521743745025	3
346	55c79e721cbee48856a309e0	[]	http://www.thebureauinvestigates.com/2012/01/11/obama-2012-strikes/	5-8 killed, possibly 2 civilians, in a strike on a house near Miransha.  Badar Mansoor, a local Pakistani al Qaeda leader, and his wife and child are believed to be amongst dead.	Ob261	0	0-3	Pakistan	2012-02-09	5-8	8	5	3	33.0020414	North Waziristan	70.06084442	[]	Badar, living in a rented house, was killed with 4-7 others. His wife and daughter were injured.	347		Miranshah	314486523116548096	1
347	55c79e721cbee48856a309e1	[]	http://www.thebureauinvestigates.com/2012/01/11/obama-2012-strikes/	6 alleged militants killed and up to 7 injured in a strike on a house near Spalga.	Ob262	0	0	Pakistan	2012-02-16	6	6	6	7	33.0020414	North Waziristan	70.06084442	[]	A US drone killed at least 5 people in a house. Several others were wounded.	348		Miranshah	315100839452745728	2
348	55c79e721cbee48856a309e2	[]	http://www.thebureauinvestigates.com/2012/01/11/obama-2012-strikes/	10-15 alleged militants killed in a strike on a vehicle in Mir Ali.	Ob263	0	0	Pakistan	2012-02-16	10-15	15	10	0	32.95826549	North Waziristan	70.24108887	[]	In the second attack of the day, drone missiles hit a pickup truck, killing 10-15 people.	349		Mir Ali	315156739349696512	0
349	55c79e721cbee48856a309e3	[]	http://www.thebureauinvestigates.com/2012/02/22/get-the-data-somalias-hidden-war/	Hours after Secretary Clinton told the London Somalia conference that airstrikes against al Shabaab 'would not be a good idea', a US drone strike killed up to seven alleged Islamists in Lower Shabelle.	SOM021	0	0	Somalia	2012-02-24	4-7	7	4	0	2.192222	Lower Shabelle	42.874722	[]	4 people dead. US official: 'a white Kenyan reported killed in the attack was not the target.'	350		60km south of Mogadishu	316304306057916417	0
350	55c79e721cbee48856a309e4	[]	http://www.thebureauinvestigates.com/2012/01/11/obama-2012-strikes/	8-15 alleged militants killed and 3 injured in a strike on a vehicle in the Mandao borderlands area. Amongst dead was German citizen Samir H, believed to be one of the most dangerous Islamists in the country.	Ob264	0	0	Pakistan	2012-03-09	8-15	15	8	3	32.321955	South Waziristan	69.864395	[]	Samir was in a large pickup truck. Above him, a US drone. Missiles killed up to 12 people.	351		Shaktoi Mandao	316388397772070913	1
351	55c79e721cbee48856a309e5	[]	http://www.thebureauinvestigates.com/2012/01/11/obama-2012-strikes/	Two sources reported a second strike. The first reportedly hit a vehicle, killing up to 15 militants. The second strike was said to have hit a house 12 kilometres away, killing 'six Uzbeks.'	Ob265	0	0	Pakistan	2012-03-09	0-6	6	0	0	32.321955	South Waziristan	69.864395	[]	Seven miles from the first strike, a US drone killed 6 people in a house.	352		Nishpa	316609412812898306	0
352	55c79e721cbee48856a309e6	[]	http://www.thebureauinvestigates.com/2012/05/08/yemen-reported-us-covert-action-2012/	A late evening airstrike on Bayda by US drones struck a gathering of alleged militants. As many as 34 'AQAP militants' died. Two brothers of local businessman Salim al-Barakani - one a teacher, the other a cellphone repairman, were among the civilians killed.	YEM042	0	'Many' (2 named)	Yemen	2012-03-09	23-34	34	23	55	14.099622	Al Bayda Province	45.432054	[Hadaar al-Homaiqani]	Salim's two brothers -- a teacher and a cellphone repairman -- were killed with 21-32 others.	353			317283336139722752	4
353	55c79e721cbee48856a309e7	[]	http://www.thebureauinvestigates.com/2012/05/08/yemen-reported-us-covert-action-2012/	Air strikes in Jaar and Zinjibar killed up to 24 alleged militants. Although initially reported as the work of the Yemen Air Force, a senior Yemen government official told CNN that the attacks were the work of the US, part of a three-day offensive.	YEM043	0	0	Yemen	2012-03-10	24	24	24	0	13.129616	Abyan Province	45.381295	[]	Up to 24 people were killed in Jaar and Zinjibar, bringing the weekend death toll to 58.	354		Jaar and Zinjibar	318929173399883776	0
354	55c79e721cbee48856a309e8	[]	http://www.thebureauinvestigates.com/2012/05/08/yemen-reported-us-covert-action-2012/	An air attack on a militant-occupied factory where arms were allegedly stored killed three near Jaar. Ansar al Sharia said US drones carried out the early evening strike, with up to five drones reportedly taking part.	YEM044	0	0	Yemen	2012-03-11	3-6	6	3	0	13.219465	Abyan Province	45.310246	[]	Five drones struck the town of Jaar, killing 6 people.	355		Jebel Khanfar	319102739151998977	0
355	55c79e721cbee48856a309e9	[]	http://www.thebureauinvestigates.com/2012/05/08/yemen-reported-us-covert-action-2012/	4-5 people were killed in a strike on a moving vehicle. CNN reported that the strike appeared to be the work of the US.	YEM045	0	0	Yemen	2012-03-13	4-5	5	4	0	14.099622	Al Bayda Province	45.432054	[Nasser al-Thafry]	A US drone killed 4-5 people in a car.	356			319168831190880256	0
356	55c79e721cbee48856a309ea	[]	http://www.thebureauinvestigates.com/2012/01/11/obama-2012-strikes/	6-8 alleged militants belived to be senoir commanders of a Taliban faction were killed and 2-4 injured in a strike on a vehicle.	Ob266	0	0	Pakistan	2012-03-13	6-8	8	6	4	32.82103747	South Waziristan	69.97999191	[]	Hafeez, Shamsullah, Wajahat, and Abdullah were killed. 3 others were 'mutilated beyond recognition.'	357		Drey Nishtar	319582698970677249	1
357	55c79e721cbee48856a309eb	[]	http://www.thebureauinvestigates.com/2012/01/11/obama-2012-strikes/	7 unknown alleged militants killed and 3 injured in a strike on a vehicle in the borderlands of North and South Waziristan.	Ob267	0	0	Pakistan	2012-03-13	7	7	7	3	32.7026315	South/North Waziristan border	69.9816857	[]	Four drone missiles hit a house and pickup truck, killing 7 people.	358		Shawa	319658375120039936	1
358	55c79e721cbee48856a309ec	[]	http://www.thebureauinvestigates.com/2012/05/08/yemen-reported-us-covert-action-2012/	According to local Yemen officials, three areas in Zinjibar were struck by US drone strikes, killing at least 30 al Qaeda fighters.	YEM048	0	0	Yemen	2012-03-22	29-30	30	29	24	13.129616	Abyan Province	45.381295	[]	US drone missiles killed at least 30 people Thursday. Dozens of others were injured.	359		Zinjibar	319858496441053185	4
359	55c79e721cbee48856a309ed	[]	http://www.thebureauinvestigates.com/2012/01/11/obama-2012-strikes/	A Miranshah house destroyed killing 4 alleged militants.	Ob268	0	0	Pakistan	2012-03-30	4	4	4	3	33.0020414	North Waziristan	70.06084442	[]	One missile pierced the ceiling. More demolished five nearby shops. 4 people were killed.	360		Miranshah	319895410766393344	1
360	55c79e721cbee48856a309ee	[]	http://www.thebureauinvestigates.com/2012/05/08/yemen-reported-us-covert-action-2012/	Four alleged AQAP militants died and three were 'critically injured' after a US drone struck their vehicles. 6-9 others were injured, including 5 civilians. One of the civilians, Mohamed, would later die.	YEM049	0	1	Yemen	2012-03-30	5	5	5	6-9	14.33936309	Shabwah Province	47.44163168	[Mohamed Saleh al Suna]	4 people killed in a Hyundai. 6 civilians wounded; Mohamed died. A 'shower' of shrapnel.	361		Azan	320613244211458048	1
361	55c79e721cbee48856a309ef	[]	http://www.thebureauinvestigates.com/2012/05/08/yemen-reported-us-covert-action-2012/	Multiple airstrikes killed as many as 38 'suspected al Qaeda militants' in Lahj and Abyan over a 48-hour period, according to CNN. A number of officials confirmed US involvement	YEM050	0	0	Yemen	2012-04-01	38	38	38	0	13.612304	Lahij and Abyan Provinces	46.106282	[]	Up to 38 people were killed in 'multiple airstrikes.'	362			321389714903011328	0
362	55c79e721cbee48856a309f0	[]	http://www.thebureauinvestigates.com/2012/05/08/yemen-reported-us-covert-action-2012/	News agencies reported a night time US drone strike on a moving vehicle in Shabwah province. The Yemen Air Force lacks the technical ability to carry out such a strike.	YEM051	0	0	Yemen	2012-04-07	0-8	8	0	0	14.653544	Shabwah Province	47.009442	[]	On Saturday night, 8 people were driving to Marib. A US drone fired a missile, killing them all.	363	Qasim al-Raimi		321428523283800064	0
363	55c79e721cbee48856a309f1	[]	http://www.thebureauinvestigates.com/2012/05/08/yemen-reported-us-covert-action-2012/	The Yemen Defence Ministry reported that 'Yemeni-U.S. joint air raids bombed al-Qaida hideouts in the southern province of Abyan, killing at least 16 militants', according to Xinhua. Other agencies did not specify US involvement.	YEM052	0	0	Yemen	2012-04-08	16	16	16	0	13.085664	Abyan Province	45.361154	[]	US drones and Yemeni warplanes bombed the southern province of Abyan, killing at least 16 people.	364		Al Kawd	322355085705359360	0
364	55c79e721cbee48856a309f2	[]	http://www.thebureauinvestigates.com/2012/05/08/yemen-reported-us-covert-action-2012/	The other militants, 8, were killed when a US drone targeted their car in the province,' alsahwa-yemen.net quoted a tribal source as saying. 		0	0	Yemen	2012-04-08	8	8	8	0	14.653544	Shabwah Province	47.009442	[]	In Shabwah, a US drone killed 8 people in a car.	365			322363051682709504	0
365	55c79e721cbee48856a309f3	[]	http://www.thebureauinvestigates.com/2012/05/08/yemen-reported-us-covert-action-2012/	A targeted evening strike on an 'al Qaeda convoy' reportedly killed up to 14 alleged militants near Loder, Abyan Province. A local government official told Xinhua that the attack was the work of a US drone.	YEM053	0	0	Yemen	2012-04-11	10-14	14	10	10	13.880199	Abyan Province	45.86811	[]	On Wednesday evening, a US drone killed 14 people and wounded 10 others on a desert road.	366		Lawder	322387422262460417	2
