	_id	articles	bij_link	bij_summary_short	bureau_id	children	civilians	country	date	deaths	deaths_max	deaths_min	injuries	lat	location	lon	names	narrative	number	target	town	tweet_id	bins
463	55c79e721cbee48856a30a55	[]	http://www.thebureauinvestigates.com/2013/01/03/yemen-reported-us-covert-actions-2013/	At least two were killed in the last strike of the night, although a military vehicle stolen from the Yemen army and carrying six was reportedly destroyed. AFP initially reported that the strike killed four people from the 'al Haytak clan, part of the Abida tribe' without specifying if they were also al Qaeda militants. However the agency subsequently reported five alleged al Qaeda militants perished in the strike, including Hamad Hassan Ghreib (aka Amhed Bin Hassan Ali Gahreib).	YEM131	0	0-4	Yemen	2013-01-19	4-6	6	4	0	15.519499	Marib Province	45.317648	[]	Up to 6 people were killed in Wadi Abida. It was the last strike of the night.	464		Wadi Abida	337687901099917312	0
464	55c79e721cbee48856a30a56	[]	http://www.thebureauinvestigates.com/2013/01/03/yemen-reported-us-covert-actions-2013/	A fourth strike was reported by the Yemen Observer. Ali al Ghulaisi, spokesman for Marib's governor, said three alleged militants were killed when a car was destroyed in a desert area of Marib near the border with Jawf province.	YEM131a	0	0	Yemen	2013-01-20	3	3	3	0	15.769722	Marib Province	45.41	[]	3 people killed in a car. 'Their identities are not yet known.'	465		Al Kanais	337689366069657601	0
465	55c79e721cbee48856a30a57	[]	http://www.thebureauinvestigates.com/2013/01/03/yemen-reported-us-covert-actions-2013/	At least two men were killed while driving on the Sanaa-Marib highway. Witnesses told Reuters a US drone targeted the vehicle northeast of the capital. Security officials said three people were injured in the strike.	YEM132	0	0	Yemen	2013-01-21	2-4	4	2	3	15.460938	Marib Province	45.321382	[]	Up to 4 men were driving on the Sanaa-Marib highway when a US drone fired missiles at them.	466		Nakhla	337690111481372672	1
466	55c79e721cbee48856a30a58	[]	http://www.thebureauinvestigates.com/2013/01/03/yemen-reported-us-covert-actions-2013/	An evening strike reportedly targeted vehicles at an alleged militant training ground, killing at least three and injuring 'several'.	YEM133	0	0	Yemen	2013-01-22	3-5	5	3	Several	16.565146	Al Jawf Province	45.538211	[]	An evening strike targeted a vehicle in al-Jawf, killing 3-5 people.	467		Al Boka	337691993671094273	1
467	55c79e721cbee48856a30a59	[]	http://www.thebureauinvestigates.com/2013/01/03/yemen-reported-us-covert-actions-2013/	A Toyota Hilux was reportedly 'totally destroyed' and the bodies burnt beyond recognition. Casualty reports have varied but a clear picture of the strike emerged in the months after the attack.	YEM134	0	2	Yemen	2013-01-23	4-7	7	4	0	15.704444	Sanaa Province	43.448889	[]	Up to 7 people died when a drone destroyed a Toyota. Bodies were burned 'beyond recognition.'	468		Khawlan	337693335747694592	0
468	55c79e721cbee48856a30a5a	[]	http://www.thebureauinvestigates.com/2013/01/03/yemen-reported-us-covert-actions-2013/	A second possible drone strike of the day killed two or four people according to conflicting media reports. The Los Angeles Times reported the strike hit two motorcycles - its intended target - and killing the alleged militants. However anonymous sources gave a contradictory account to Xinhua. They said the strike missed the bikes, hitting a house belonging to Abdu Mohammed al-Jarrah. Two of his children were reportedly killed and three more family members injured.	YEM135	2	0-2	Yemen	2013-01-23	2-4	4	2	0-3	13.986689	Al Bayda Province	45.574143	[]	A second possible drone attack missed its target and left 2 children dead in their home.	469		Qayfa	337694456809676800	1
469	55c79e721cbee48856a30a5b	[]	http://www.thebureauinvestigates.com/2013/01/03/obama-2013-pakistan-drone-strikes/	CIA drones destroyed a house and killed at least 3. Between two and six missiles reportedly hit a building, which caught fire.	Ob312	0	0-2	Pakistan	2013-02-06	3-6	5	3	1	32.95826549	North Waziristan	70.24108887	[]	At noon, between two and six missiles landed on a house and killed up to 5 people.	470		Spinwam	337695779345027072	1
470	55c79e721cbee48856a30a5c	[]	http://www.thebureauinvestigates.com/2013/01/03/obama-2013-pakistan-drone-strikes/	CIA drones destroyed a house, killing at least 6, in an area reportedly dominated by the TTP.	Ob313	0	0	Pakistan	2013-02-08	6-9	9	6	6	32.65389	South Waziristan	70.19083	[]	6-9 people were killed when a US drone 'pounded' two mud-built houses in South Waziristan.	471		Babar Ghar	337697050235920384	2
471	55c79e721cbee48856a30a5d	[]	http://www.thebureauinvestigates.com/2013/01/03/obama-2013-pakistan-drone-strikes/	Drones kill at least one alleged militant, reportedly on horseback in North Waziristan. The horse died with its rider.	Ob314	0	0	Pakistan	2013-03-10	1-3	3	1	1	33.151242	North Waziristan	70.434707	[]	A drone fired missiles at men riding on horseback, killing them and their horses instantly.	472		Datta Khel	337698497010745345	1
472	55c79e721cbee48856a30a5e	[]	http://www.thebureauinvestigates.com/2013/01/03/obama-2013-pakistan-drone-strikes/	Either a house or vehicle was destroyed, killing at least three alleged militants.	Ob315	0	0	Pakistan	2013-03-21	1-4	4	1	1	33.151242	North Waziristan	70.434707	[]	Up to 4 people were killed at a market in Datta Khel.	473		Datta Khel	337701074943217664	1
473	55c79e721cbee48856a30a5f	[]	http://www.thebureauinvestigates.com/2013/01/03/obama-2013-pakistan-drone-strikes/	At least four killed in first strike for 24 days. The dead were badly burnt and went unidentified after the third consecutive strike on Datta Khel set a house on fire.	Ob316	0	0	Pakistan	2013-04-14	4-5	5	4	0	33.151242	North Waziristan	70.434707	[]	Six drones had been hovering. At sunset, one fired missiles at a house, killing 4-6 people.	474		Datta Khel	337703459988074496	0
474	55c79e721cbee48856a30a60	[]	http://www.thebureauinvestigates.com/2013/01/03/obama-2013-pakistan-drone-strikes/	CIA drones destroyed a house in South Waziristan, killing at least four, the day after the ICRC's president criticised the US' drone campaign in Pakistan.	Ob317	0	0	Pakistan	2013-04-17	4-6	6	4	0	32.516081	South Waziristan	70.02398	[]	Drone missiles destroyed a house in Wana, killing 4-6 people and injuring 7 others.	475		Sararogha	337707323197902848	0
475	55c79e721cbee48856a30a61	[]	http://www.thebureauinvestigates.com/2013/01/03/yemen-reported-us-covert-actions-2013/	"Five alleged al Qaeda militants were killed in the first US drone strike in almost three months. Journalist and activist Farea al Muslimi, a native of Wessab, contested the depiction of al Radami as an al Qaeda commander, although he also reported the view that al Rademi could easily have been arrested. Al Muslimi posted updates to Twitter from Sanaa as information came to him from friends and family in Wessab. And he said most people he spoke to said al Radami was not a part of AQAP. Al Muslimi: ""In an area like Wessab, there is nothing easier than capturing a man like al-Radmi. Two police officers would have been more than capable of arresting him."""	YEM136	0	0	Yemen	2013-04-17	4-5	5	4	0	14.550014	Dhammar Province	44.400374	[Hamid al Radami, Mukram Ali Ahmed Hamoud al Haj, Najem Addin Ali Abdullah al Raai, Ghazi Hamoud al Imad, Ismael al Magdishi]	In the farming town of Wessab, a drone hovered. 5 people were killed in a car.	476		Wessab	337712862350962688	0
476	55c79e721cbee48856a30a62	[]	http://www.thebureauinvestigates.com/2013/01/03/yemen-reported-us-covert-actions-2013/	A dawn strike on a house in Marib province reportedly killed two alleged al Qaeda militants and wounded up to three others. Local media reported a Saudi and an Egyptian were killed while a woman and child were injured.	YEM137	0	0	Yemen	2013-04-21	2	2	2	2-3	15.519499	Marib Province	45.317648	[]	Missiles hit a house at dawn, killing 2 people. A woman and child were among the injured.	477		Wadi Abida	337726021900050432	1
477	55c79e721cbee48856a30a63	[]	http://www.thebureauinvestigates.com/2013/01/03/yemen-reported-us-covert-actions-2013/	US drones reportedly destroyed a truck filled with explosives, killed at least four people. The dead were allegedly militants although a 'local dignitary' told AFP he could not say whether the four 'were Islamist militants'.	YEM138	0	0	Yemen	2013-05-18	4-7	7	4	Some	14.037734	Abyan Province	46.767517	[]	On Friday night, a US drone fired missiles at a truck in Al-Mahfad, killing 4-7 people.	478		Al Mahfad	337735031051149312	1
478	55c79e721cbee48856a30a64	[]	http://www.thebureauinvestigates.com/2013/01/03/yemen-reported-us-covert-actions-2013/	The second strike in three days killed two men in central Yemen. Two alleged al Qaeda members were killed 'as they left a farm on a motorbike' according to Yemen's defence ministry website.	YEM139	0	0	Yemen	2013-05-20	2	2	2	0	14.410844	Al Bayda Province	44.840248	[]	The second drone strike in three days killed 2 men in a car.	479		Radaa	337753184107917312	0
479	55c79e721cbee48856a30a65	[]	http://www.thebureauinvestigates.com/2013/01/03/obama-2013-pakistan-drone-strikes/	The Pakistan Taliban's second in command Wali ur Rehman was reportedly killed in the first CIA strike in Pakistan for 42 days. At least three other people were killed in the attack in the Miranshah area of North Waziristan.	Ob318	0	0	Pakistan	2013-05-29	4-7	7	4	1-4	32.97742	North Waziristan	70.08634	[]	A US drone fired missiles at a mud-built house in Chashma, killing 7 people.	480		Chashma village, near Miranshah	339607953709600769	1
480	55c79e721cbee48856a30a66	[]	http://www.thebureauinvestigates.com/2013/01/03/yemen-reported-us-covert-actions-2013/	Two vehicles carrying alleged AQAP militants were destroyed in either two separate strikes or single strike by a pair of aircraft. At least seven people were killed in the attack. Anonymous and named Yemen officials have said US drones carried out the strike.	YEM140	0	0	Yemen	2013-06-01	7-8	8	7	2-3	14.03382	Abyan Province	46.786228	[]	On Saturday, two US drone strikes killed 7 people in their cars.	481		Al Mahfad	341268924584841216	1
481	55c79e721cbee48856a30a67	[]	http://www.thebureauinvestigates.com/2013/01/03/obama-2013-pakistan-drone-strikes/	A night-time strike reportedly killed seven alleged militants and wounded others on the border of North and South Waziristan, Pakistani intelligence officials said. 'The US drone fired two missiles targeting a militant compound and killing at least seven militants,' an unnamed senior intelligence official told AFP.	Ob319	0	0	Pakistan	2013-06-07	7	7	7	3-4	32.779193	North Waziristan	69.873047	[]	A US drone strike killed 7 people in Shawal.	482		Shawal	343067155048329216	1
482	55c79e721cbee48856a30a68	[]	http://www.thebureauinvestigates.com/2013/01/03/yemen-reported-us-covert-actions-2013/	Multiple missiles struck a vehicle in the northern province of al Jawf, killing between two and six alleged militants. A local reporter tweeted that Huraydan had died alongside two relatives, including his 10-year-old brother.	YEM141	1	0-2	Yemen	2013-06-09	2-6	6	2	0	16.696709	Al Jawf Province	45.109863	[]	On Sunday, a US drone fired missiles at a car, killing Hassan, his brother, and 'three others.'	483		Al Mahashma or Khab al-Shath	343754317863456769	0
483	55c79e721cbee48856a30a69	[]	http://www.thebureauinvestigates.com/2013/01/03/obama-2013-pakistan-drone-strikes/	At least 16 people were killed when CIA drones hit a house and a vehicle in or around the Miranshah bazaar. Casualty figures were low in initial reports but rose as the day wore on. By around 11am local time Reuters and AFP were reporting 17 killed in the strike.	Ob320	0	0	Pakistan	2013-07-03	16-18	18	16	2-5	33.0020414	North Waziristan	70.06084442	[]	At least 17 people were killed when US drones fired four missiles at a house.	484		Miranshah	352402499115810816	1
484	55c79e721cbee48856a30a6a	[]	http://www.thebureauinvestigates.com/2013/01/03/obama-2013-pakistan-drone-strikes/	A drone strike killed two alleged militants riding on a motorcycle and damaged nearby buildings in the village of Mosaki, near Mir Ali.	Ob321	0	0	Pakistan	2013-07-13	2-3	3	2	0	32.99988191	North Waziristan	70.34082413	[]	On Saturday night, an American drone fired missiles at a motorcycle. 2 people were killed.	485		Mosaki	356147147080605698	0
485	55c79e721cbee48856a30a6b	[]	http://www.thebureauinvestigates.com/2013/01/03/yemen-reported-us-covert-actions-2013/	A night-time strike on two vehicles travelling in convoy reportedly killed at least four alleged militants in the al Mahfad district of Abyan province; some sources put the death toll as high as eight. It was the first reported attack in seven weeks.	YEM142	0	0	Yemen	2013-07-27	4-9	9	4	0	14.037317	Abyan Province	46.768633	[]	A US drone killed 6 people in Abyan.	486		Al Mahfad	361558795060645888	0
486	55c79e721cbee48856a30a6c	[]	http://www.thebureauinvestigates.com/2013/01/03/obama-2013-pakistan-drone-strikes/	A drone fired missiles at a home in the Shawal Valley, killing at least five alleged militants, with some reports suggesting eight had died. News reports carried different, apparently contradictory narratives of the strike. Locals told NBC the drone struck as a group gathered for Iftar dinner - the breaking of the fast that takes place each night during Ramadan.'The militants, including Arab fighters, were having an Iftar dinner in the compound when the drone fired two missiles. Later, an hour after the drone had disappeared, a group of militants arrived and started pulling out bodies,' 	Ob322	0	0	Pakistan	2013-07-28	5-8	8	5	3-4	32.779193	North Waziristan	69.873047	[]	8 people were having dinner when a US drone fired missiles at them.	487		Shawal	361594480975024129	1
487	55c79e721cbee48856a30a6d	[]	http://www.thebureauinvestigates.com/2013/01/03/yemen-reported-us-covert-actions-2013/	A suspected US drone strike killed three people in a vehicle in the southern province of Shabwa. Two Yemenis and one Saudi Arabian, all alleged militants, were killed.	YEM143	0	0	Yemen	2013-07-30	3-4	4	3	0	14.588566	Shabwah Province	46.332241	[]	Early on Tuesday, in the town of Saeed, a US drone blew 3 people and a car 'to pieces.'	488		Al Saeed	362282933517688832	0
488	55c79e721cbee48856a30a6e	[]	http://www.thebureauinvestigates.com/2013/01/03/yemen-reported-us-covert-actions-2013/	A suspected US drone killed at least four people on the day Yemen's President Hadi visited the White House to discuss counter-terrorism and political reform. It was the third strike in a week.	YEM144	1	0	Yemen	2013-08-01	3-5	5	3	3	15.904444	Hadhramaut Province	48.568056	[]	In the fourth drone strike since Saturday, 3-4 people were killed in a car.	489		Wadi Ser	362922386120642562	1
489	55c79e721cbee48856a30a6f	[]	http://www.thebureauinvestigates.com/2013/01/03/yemen-reported-us-covert-actions-2013/	Four alleged AQAP militants were killed in a suspected drone strike. The men were killed when as many as five missiles hit their vehicle as they drove through the central province of Marib in the early hours. All four in the car were Yemeni and the attack 'turned [the vehicle] into a ball of fire', a tribal source told AFP.	YEM145	0	0	Yemen	2013-08-06	4	4	4	0	15.519499	Marib Province	45.317648	[]	Two US drone strikes killed 4 men in Marib.	490		Wadi Abeeda	364740379402190848	0
490	55c79e721cbee48856a30a70	[]	http://www.thebureauinvestigates.com/2013/01/03/yemen-reported-us-covert-actions-2013/	At least six people were killed in the early hours in the second strike in two days and fifth inside two weeks. A drone fired at least six missiles at two cars in a remote area, witnesses and local officials told Reuters. Local residents said they saw two vehicles and several bodies on fire at the scene. One of the dead, Sarhan al Thamlaqi, was named by local paper Yemen Post. He was reportedly not on a list of 25 AQAP operatives wanted for planning operations in Sanaa and other Yemeni provinces.	YEM146	0	0	Yemen	2013-08-07	6-8	8	6	Some	14.98284	Shabwah Province	46.59975	[]	Up to 7 people were killed when US drone missiles destroyed a pair of cars.	491		Markha	364983785978200064	1
491	55c79e721cbee48856a30a71	[]	http://www.thebureauinvestigates.com/2013/01/03/yemen-reported-us-covert-actions-2013/	Up to six people were reported killed in the third air strike in three days and sixth in under two weeks - a frequency of strikes not seen since the start of the year. The strike destroyed one or two vehicles at dawn - according to Yemeni media one vehicle was destroyed, killing four, and the second escaped the attack. Reuters reported two drones took part in the attack, remaining over the strike area for 'a while after the attack'. A Yemeni official told the Associated Press the bodies were seen lying charred alongside their vehicle. The anonymous source said five of the dead were Yemeni while the sixth was of another Arab nationality. However local security officials told CNN only four of the dead had links to AQAP - two were civilians.	YEM147	0	0-2	Yemen	2013-08-08	4-8	8	4	0	15.51948	Marib Province	45.317652	[]	6 people were killed at dawn. 'The drones circled the air for a while after the attack.'	492		Wadi Abeeda	365515196573298688	0
492	55c79e721cbee48856a30a72	[]	http://www.thebureauinvestigates.com/2013/01/03/yemen-reported-us-covert-actions-2013/	At least two people were killed in the second strike of the day. The attack hit at around 4pm local time, destroying a car, reportedly a Toyota Hilux. It was travelling through the eastern province of Hadramout. Witnesses reported seeing drones hovering over the area since dawn.	YEM148	0	0	Yemen	2013-08-08	2-3	3	2	0	14.635202	Hadhramaut Province	49.008491	[]	The second drone strike of the day killed 2-3 people in a Toyota.	493		Al Oyoun	365532286977966080	0
493	55c79e721cbee48856a30a73	[]	http://www.thebureauinvestigates.com/2013/01/03/yemen-reported-us-covert-actions-2013/	At least three people were killed in a night strike on Hadramout - the third strike in three days. An unnamed official told CNN one of the three dead was a member of al Qaeda. However Yemeni officials told BBC Arabic that four alleged militants were killed in Wadi al Jadd. And Reuters reported three men were killed as they travelled in a vehicle in an area called Ghail Bawazeer. Residents heard a large explosion and later saw the car destroyed, the agency reported. Anonymous US officials confirmed drones carried out the attack. 	YEM149	0	0	Yemen	2013-08-08	3-5	5	3	0	15.840861	Hadhramaut Province	48.483724	[]	For the third time in one day, a US drone fired missiles at a car. 3 people were killed.	494		Al Qatn	365580166526795776	0
494	55c79e721cbee48856a30a74	[]	http://www.thebureauinvestigates.com/2013/01/03/yemen-reported-us-covert-actions-2013/	US drones returned for the ninth time in 13 days killing at least two alleged al Qaeda militants. The men were travelling in a vehicle through Lahj province when the drones struck. Some reports said the attack targeted two vehicles, which were transporting weapons. The drones either destroyed both or one vehicle managed to escape, depending on the report. The attack came late in the evening in a mountainous area of the province. Activist and journalist Farea al-Muslimi later tweeted that three civilian bystanders were injured, and provided their names: Sidki Muhammed Ali, Ali Abdullah Hassan, and Fahmi Ahmed Hassan.	YEM150	0	0	Yemen	2013-08-10	2-5	5	2	2-5	13.232191	Lahj Province	44.777508	[]	At least 2 people were killed by a US drone while driving on a mountain road.	495		Al Askariya	366288111250059265	1
495	55c79e721cbee48856a30a75	[]	http://www.thebureauinvestigates.com/2013/01/03/yemen-reported-us-covert-actions-2013/	Reuters is currently the only western news outlet reporting a late-night drone strike in Shabwa province. A local official told the agency a suspected US drone attacked a vehicle. 'The car was completely obliterated and the two men inside it were killed,' he said. There was no information about the identity of the dead men, although Reuters described them as 'suspected Islamist militants'. Locals also mentioned rumours of the strike on Twitter.	YEM150c	0	0	Yemen	2013-08-12	2	2	2	0	16.1532	Shabwah Province	43.1867	[]	A possible US drone strike 'obliterated' a car, killing 2 people inside. Unclear who they were.	496			367682346029309952	0
496	55c79e721cbee48856a30a76	[]	http://www.thebureauinvestigates.com/2013/01/03/yemen-reported-us-covert-actions-2013/	A senior militant leader was targeted and killed in a pre-dawn strike. Suspected US drones attacked a vehicle between midnight and 2am, killing both occupants including senior leader Qaid Ahmad Nasser al Dhahab. Sources alleged US drones destroyed the vehicle killing two before returning to hit the target again, killing at least two more.	YEM151	0	0	Yemen	2013-08-30	4-6	6	4	0	14.099622	Al Bayda Province	45.432054	[]	Hours after Qaid's marriage, two US drones launched missiles at his car, killing up to 6 people.	497		Manasseh	373485780712173568	0
497	55c79e721cbee48856a30a77	[]	http://www.thebureauinvestigates.com/2013/01/03/obama-2013-pakistan-drone-strikes/	At least three alleged militants were killed in an attack on what was reported to be either a vehicle near a seminary or a house in the Mir Ali area. One person was reported critically injured and taken to Mir Ali hospital. The strike, which took place at around 12.30pm, 'destroyed the vehicle and severely damaged the walls of the seminary.'	Ob323	0	0	Pakistan	2013-08-31	3-4	4	3	1	32.96201033	North Waziristan	70.33344269	[]	At least 4 people died by drone. Official: 'We do not know the identity of those killed.'	498		Hassokhel	373922910533980160	1
498	55c79e721cbee48856a30a78	[]	http://www.thebureauinvestigates.com/2013/01/03/obama-2013-pakistan-drone-strikes/	At least five alleged militants were killed in the second drone strike in a week. Two or three missiles were fired on a house intelligence sources said belonged to the Haqqani Network in an area was reportedly under Haqqani control. Anonymous intelligence officials also said 'seven badly burnt and mutilated bodies were pulled from the wreckage after the drones disappeared'.	Ob324	0	0	Pakistan	2013-09-06	5-7	7	5	3-4	33.04694673	North Waziristan	70.02033234	[]	A US drone fired missiles at a house, killing 6 people. Official: 'death toll may rise.'	499		Darga Mandi	375732088160260096	1
499	55c79e721cbee48856a30a79	[]	http://www.thebureauinvestigates.com/2013/01/03/obama-2013-pakistan-drone-strikes/	At least six people died in the first CIA drone strike for 16 days. Four missiles reportedly hit two houses. The identify of those killed was not immediately known, an anonymous Pakistani official said. Local TV news reportedly said the strike hit at 3pm local time. The houses were 'reduced to debris'.	Ob325	0	0	Pakistan	2013-09-22	6-7	7	6	2-4	32.7026315	North/South Waziristan border	69.9816857	[]	Four missiles struck a pair of houses in Shawal. Up to 7 people were killed.	500		Shawal	382579147781844992	1
500	55c79e721cbee48856a30a7a	[]	http://www.thebureauinvestigates.com/2013/01/03/obama-2013-pakistan-drone-strikes/	At least three were killed when drones fired missiles on a house in North Waziristan. The strike hit around 11am local time; the house was destroyed. This was the second drone strike on Darga Mandi this month.	Ob326	0	0	Pakistan	2013-09-29	3-6	6	3	1-3	33.04694673	North Waziristan	70.02033234	[]	On Sunday morning, a US drone strike killed 3-6 people in North Waziristan.	501		Darga Mandi	384357169782468608	1
501	55c79e721cbee48856a30a7b	[]	http://www.thebureauinvestigates.com/2013/01/03/obama-2013-pakistan-drone-strikes/	Drones hit North Waziristan for the second time in 24 hours, killing at least three. The drones again targeted a house, at about 4am local time according to one report.	Ob327	0	0	Pakistan	2013-09-30	2-4	4	2	2-4	33.02133047	North Waziristan	69.82566833	[]	The second strike in two days killed 4 people in Datta Khel. 'Several others' were injured.	502		Datta Khel	384691770904162304	1
502	55c79e721cbee48856a30a7c	[]	http://www.thebureauinvestigates.com/2012/02/22/get-the-data-somalias-hidden-war/	Two people were killed in an attack on a vehicle. Four witnesses reportedly said the men were militants and were Somali. One was reportedly Ibrahim Ali Abdi (aka Anta Anta), a senior al Shabaab commander responsible for several bomb attacks in the country. Abu Mohamed, an al Shabaab militant, also said Abdi was among the dead. 	SOM025	0	0	Somalia	2013-10-28	2	2	2	0	0.4932	Middle Juba	42.77408	[]	Hassan heard a crash. Saw a drone 'disappearing far into the sky.' 2 people killed in a car.	503		Jilib	394865386471960576	0
503	55c79e721cbee48856a30a7d	[]	http://www.thebureauinvestigates.com/2013/01/03/obama-2013-pakistan-drone-strikes/	US drones killed up to five and injured three more in the first strike for a month,. The unmanned aircraft targeted a house and car in or near a bazaar in Miranshah, the capital of North Waziristan.	Ob328	0	0	Pakistan	2013-10-31	0-5	5	0	3	33.0017	North Waziristan	70.0673	[]	A US drone fired missiles at a house, killing at least 3 people.	504		Zafar area of Miranshah	395664410967961601	1
504	55c79e721cbee48856a30a7e	[]	http://www.thebureauinvestigates.com/2013/01/03/obama-2013-pakistan-drone-strikes/	US drones reportedly killed TTP leader Hakimullah Mehsud in a strike on his car or house a few miles from Miranshah, the capital of North Waziristan. He was killed in what could be one of the bloodiest strikes of 2013: at least three and as many as 25 people were reportedly killed.	Ob329	0	0	Pakistan	2013-11-01	5-25	25	5	2	33.020179	North Waziristan	70.07286072	[]	Four missiles came for Hakimullah, ending the lives of up to 25 people.	505		Danda Darpakhel	396352800671535104	1
