	_id	articles	bij_link	bij_summary_short	bureau_id	children	civilians	country	date	deaths	deaths_max	deaths_min	injuries	lat	location	lon	names	narrative	number	target	town	tweet_id	bins
121	55c79e721cbee48856a308ff	[]	http://www.thebureauinvestigates.com/2011/08/10/obama-2010-strikes/	Five civilians reportedly among nine killed as they drive to sites of previous attacks. Pai Khel, North Waziristan.	Ob67	0	5	Pakistan	2010-02-02	9	9	9	0	32.97756412	North Waziristan	69.64164734	[]	9 people were killed in a third strike while traveling to help with rescue work	122		Pai Khel	278652292096462848	0
122	55c79e721cbee48856a30900	[]	http://www.thebureauinvestigates.com/2011/08/10/obama-2010-strikes/	Attack on village, casualties unknown. Toor Narai, North Waziristan.	Ob68	0	Unknown	Pakistan	2010-02-02	Unknown	0	0	0	32.97410796	North Waziristan	69.7262764	[]	In the 4th strike of the day, US drones struck the village of Toor Narai; death toll is unknown.	123		Toor Narai	278652425869606914	0
123	55c79e721cbee48856a30901	[]	http://www.thebureauinvestigates.com/2011/08/10/obama-2010-strikes/	Three alleged militants killed in strike on house and car in Mir Ali, North Waziristan.	Ob69	0	Unknown	Pakistan	2010-02-14	7	7	7	4	32.95826549	North Waziristan	70.24108887	[]	At least 6 people were killed Sunday when two missiles fired from an American drone struck Mir Ali.	124		Mir Ali	278657482270859264	1
124	55c79e721cbee48856a30902	[]	http://www.thebureauinvestigates.com/2011/08/10/obama-2010-strikes/	Abdul Haq al-Turkistani, leader of militant group the Turkistani Islamic Party among up to five killed in attack on car in Tappi, North Waziristan.	Ob70	0	Unknown	Pakistan	2010-02-15	4-5	5	4	0	33.00175347	North Waziristan	70.01415253	[]	4 people were killed on Monday when a drone fired 2 missiles at a vehicle in Tappi, North Waziristan.	125		Tappi	278662628639920128	0
125	55c79e721cbee48856a30903	[]	http://www.thebureauinvestigates.com/2011/08/10/obama-2010-strikes/	Al Qaeda operative Shaikh Mansoor among four killed in strike on guesthouse.	Ob71	0	Unknown	Pakistan	2010-02-17	4	4	4	3	32.99973794	North Waziristan	70.1902771	[]	A US drone killed 4 people and wounded 2 others in the village of Tabi Tolkhel.	126		Tabbi	278664458132393986	1
126	55c79e721cbee48856a30904	[]	http://www.thebureauinvestigates.com/2011/08/10/obama-2010-strikes/	Three named militants among up to 4-5 killed in vehicle in Danda Darpakhel, North Waziristan.	Ob72	0	0	Pakistan	2010-02-18	4-5	5	4	4	33.020179	North Waziristan	70.07286072	[]	Two missiles hit a house. Three people were killed, five were wounded.	127		Danda Darpakhel	278665230400225282	1
127	55c79e721cbee48856a30905	[]	http://www.thebureauinvestigates.com/2011/08/10/obama-2010-strikes/	5-6 civilians, including a small child, among up to 13 killed in attack on house and car in Dargi Mandi. North Waziristan.	Ob73	1	5-6	Pakistan	2010-02-24	5-13	13	5	6	33.04694673	North Waziristan	70.02033234	[]	10-year-old Naila was at home reciting the Quran when the strike hit. She died on the spot.	128		Darga Mandi	278675268267307009	2
128	55c79e721cbee48856a30906	[]	http://www.thebureauinvestigates.com/2011/08/10/obama-2010-strikes/	Nine al Qaeda, including Hussein al-Yemeni, killed in strike on hotel in Miranshah, North Waziristan.	Ob74	0	Unknown	Pakistan	2010-03-08	9	9	9	2	33.0020414	North Waziristan	70.06084442	[]	Up to 9 people were killed when a US drone fired 5 missiles into a hotel near Miranshah.	129		Miranshah	278687621985751040	1
129	55c79e721cbee48856a30907	[]	http://www.thebureauinvestigates.com/2011/08/10/obama-2010-strikes/	Eight killed in strike on house and car in Madakhel, North Waziristan.	Ob75	0	Possibly	Pakistan	2010-03-10	8	8	8	12	32.99369109	North Waziristan	69.61641312	[]	12 people were killed when 7 missiles hit the village of Mizar Madakhel.	130		Mizar Madakhel	278687679766462465	3
130	55c79e721cbee48856a30908	[]	http://www.thebureauinvestigates.com/2011/08/10/obama-2010-strikes/	Seven rescuers, at least four of them civilians, killed as they try to retrieve dead and injured, Datta Khel, North Waziristan.	Ob76	0	4	Pakistan	2010-03-10	7	7	7	0	32.99369109	North Waziristan	69.61641312	[]	US drones fired more missiles, killing 8, as residents of nearby Ziarat came to recover bodies.	131		Mizar Madakhel	278687723282395137	0
131	55c79e721cbee48856a30909	[]	http://www.thebureauinvestigates.com/2011/08/10/obama-2010-strikes/	At least 10 killed including eight al Qaeda in Datta Khel, North Waziristan.	Ob77	0	0-3	Pakistan	2010-03-16	10-11	11	10	2	33.151242	North Waziristan	70.434707	[]	The blasts knocked Hanif down, leaving a tangled mess of smoking metal where the cars had been.	132		Datta Khel	278708103611043840	1
132	55c79e721cbee48856a3090a	[]	http://www.thebureauinvestigates.com/2011/08/10/obama-2010-strikes/	Five alleged militants killed after two cars attacked in Hamzoni, North Waziristan.	Ob78	0	Possible	Pakistan	2010-03-17	5	5	5	4	33.00664813	North Waziristan	69.94308472	[]	4 US drone missiles struck a vehicle, killing 3 people and leveling a home near Miranshah.	133		Hamzoni	278722428585254912	1
133	55c79e721cbee48856a3090b	[]	http://www.thebureauinvestigates.com/2011/08/10/obama-2010-strikes/	Five alleged militants killed in strike on car in Mada Khel, North Waziristan.	Ob79	0	Unknown	Pakistan	2010-03-17	5	5	5	0	32.99369109	North Waziristan	69.61641312	[]	Half an hour later, 5 more people died in an attack near Maizar Madakhel.	134		Mizar Madakhel	278722518158831616	0
134	55c79e721cbee48856a3090c	[]	http://www.thebureauinvestigates.com/2011/08/10/obama-2010-strikes/	5-8 alleged militants killed in Lowari Mandi, North Waziristan.	Ob80	0	Unknown	Pakistan	2010-03-21	5-8	8	5	0	32.99527483	North Waziristan	69.6818161	[]	A US drone killed 8 people Sunday when it fired two missiles in Lowari Mandi.	135		Inzar	278727637986328576	0
135	55c79e721cbee48856a3090d	[]	http://www.thebureauinvestigates.com/2011/08/10/obama-2010-strikes/	Six alleged militants killed in strike on car and house in Machis, North Waziristan.	Ob81	0	Possible	Pakistan	2010-03-23	6	6	6	3	32.98073215	North Waziristan	70.05329132	[]	Missiles fired from a US drone killed at least 6 people Tuesday, wounding 3 others.	136		Machis	278727678721396738	1
136	55c79e721cbee48856a3090e	[]	http://www.thebureauinvestigates.com/2011/08/10/obama-2010-strikes/	Four people, possibly all civilians, killed in attack on houses in Hurmaz, North Waziristan.	Ob82	0	0-4	Pakistan	2010-03-27	4	4	4	5	32.9684554	North Waziristan	70.25271893	[]	A pilotless US drone fired 2 missiles at a village house. 4 people were killed, 5 wounded.	137		Hurmuz	278727716801486848	1
137	55c79e721cbee48856a3090f	[]	http://www.thebureauinvestigates.com/2011/08/10/obama-2010-strikes/	Five members of a family among up to six civilians killed in strike on ex-school in Tappi, North Waziristan.	Ob83	1	5-6	Pakistan	2010-03-31	5-6	6	5	2	33.00175347	North Waziristan	70.01415253	[]	6 people were reported killed and 2 injured in an attack on a former school.	138		Tappi	278727931818278913	1
138	55c79e721cbee48856a30910	[]	http://www.thebureauinvestigates.com/2011/08/10/obama-2010-strikes/	At least eight civilians among 13 reported killed in Boya, North Waziristan.	Ob84	0	8-13	Pakistan	2010-04-12	13	13	13	2	33.02133047	North Waziristan	69.82566833	[]	13 people were killed Monday when a US drone struck the village of Boya.	139		Boya	278890277261946880	1
139	55c79e721cbee48856a30911	[]	http://www.thebureauinvestigates.com/2011/08/10/obama-2010-strikes/	Four killed in car in Angar Shaga, North Waziristan.	Ob85	0	Unknown	Pakistan	2010-04-14	4	4	4	3	33.00146554	North Waziristan	69.52835083	[]	An unmanned US drone fired two missiles at a vehicle near Anbar Shaga, killing 4 people.	140		Ambar Shaga	278937616492146689	1
140	55c79e721cbee48856a30912	[]	http://www.thebureauinvestigates.com/2011/08/10/obama-2010-strikes/	At least three alleged militants and rescuers killed in attack in Toor Khel, North Waziristan.	Ob86	0	0	Pakistan	2010-04-16	3-4	4	3	0	32.98677989	North Waziristan	70.26082993	[]	Missiles fired from US drones killed 4 in Tolkhel, hitting a car and people rushing in to help.	141		Toorikhel	278953252358352897	0
141	55c79e721cbee48856a30913	[]	http://www.thebureauinvestigates.com/2011/08/10/obama-2010-strikes/	7-9 alleged militants killed in Machi Khel, North Waziristan.	Ob87	0	Unknown	Pakistan	2010-04-24	7-9	9	7	0	32.99628265	North Waziristan	70.30838013	[]	7 people were killed and several others injured when a US drone struck the village of Machi Khel.	142		Machi Khel	278971156227293184	0
142	55c79e721cbee48856a30914	[]	http://www.thebureauinvestigates.com/2011/08/10/obama-2010-strikes/	6-8 killed in attack on Taliban commander's home in Khushali Toorkhel, North Waziristan.	Ob88	0	Unknown	Pakistan	2010-04-26	6-8	8	6	3	32.96863543	North Waziristan	70.35301208	[]	Three missiles fired by a US drone killed 5 people in North Waziristan.	143		Khushali	278995560730599424	1
143	55c79e721cbee48856a30915	[]	http://www.thebureauinvestigates.com/2011/08/10/obama-2010-strikes/	German militant Eric Breininger, alias Abdul Gaffar el-Almani, among 4-6 dead, two possibly civilians in Mir Ali, North Waziristan.	Ob89	0	0-2	Pakistan	2010-05-03	4-6	6	4	0	32.99628265	North Waziristan	70.30838013	[]	3 missiles were fired minutes apart at a moving vehicle in Marsi Khel, killing 4 people.	144		Machi Khel	279011677767340032	0
144	55c79e721cbee48856a30916	[]	http://www.thebureauinvestigates.com/2011/08/10/obama-2010-strikes/	10 killed including four reported civilians in attack on house in Datta Khel, North Waziristan.	Ob90	0	4	Pakistan	2010-05-09	10	10	10	4	33.151242	North Waziristan	70.434707	[]	2 missiles hit the house of Awal Gul, a local tribesman, killing 10 in the village of Inzarkas.	145		Datta Khel	279013145253646336	1
145	55c79e721cbee48856a30917	[]	http://www.thebureauinvestigates.com/2011/08/10/obama-2010-strikes/	Villagers among 13-14 dead in attack on car and house in Doga, Datta Khel, North Waziristan.	Ob91	0	Some'	Pakistan	2010-05-11	13-14	14	13	12	33.151242	North Waziristan	70.434707	[]	A swarm of US drones launched 12 missiles Friday, killing up to 14 people in Datta Khel.	146		Datta Khel	279073479079366656	3
146	55c79e721cbee48856a30918	[]	http://www.thebureauinvestigates.com/2011/08/10/obama-2010-strikes/	7-15 alleged militants killed in attack on Gorwek, North Waziristan.	Ob92	0	0-5	Pakistan	2010-05-11	7-15	15	7	4	33.03860068	North Waziristan	69.53933716	[]	Hours later, another pair of missiles killed 10 more people. Drones were hovering all night.	147		Gurwak	279073622784610304	1
147	55c79e721cbee48856a30919	[]	http://www.thebureauinvestigates.com/2011/08/10/obama-2010-strikes/	5-15 killed including up to two civilians in first known attack on Khyber Agency.	Ob93	0	2	Pakistan	2010-05-15	5-15	15	5	15	33.876401	Khyber Agency	70.84911346	[]	Two missiles hit a house in Khyber. Reports of the death toll ranged from 5 to 15 people.	148		Khyber	279122014369902592	3
148	55c79e721cbee48856a3091a	[]	http://www.thebureauinvestigates.com/2011/08/10/obama-2010-strikes/	Al Qaeda's chief finance officer Mustafa Abu Yazid killed with at least nine others, six of them civilians, in Mohammad Khel, North Waziristan.	Ob94	4	6	Pakistan	2010-05-21	10-12	12	10	10	33.02133047	North Waziristan	69.82566833	[]	4 children--including Fatima, Nisar and Naeem Khan--were killed when a drone hit Mohammad Khel.	149		Boya	279258960916271105	2
149	55c79e721cbee48856a3091b	[]	http://www.thebureauinvestigates.com/2011/08/10/obama-2010-strikes/	8-12 killed including two named militants and possibly some civilians in Mizai Nara, South Waziristan.	Ob95	0	Possible	Pakistan	2010-05-28	8-12	12	8	4	32.28959963	South Waziristan	69.29111481	[]	At least 11 people were killed in a village near Mizai Narai. 3 others were wounded.	150		Mizai Nari	279451964037820416	1
150	55c79e721cbee48856a3091c	[]	http://www.thebureauinvestigates.com/2011/08/10/obama-2010-strikes/	Two named militants among seven killed in Khaddi or Norak, North Waziristan.	Ob96	0	4	Pakistan	2010-06-10	7	7	7	0	32.98879572	North Waziristan	70.32606125	[]	A US drone fired 2 missiles at a house in the village of Khaddi, killing 3 people.	151		Norak	279644143972663296	0
151	55c79e721cbee48856a3091d	[]	http://www.thebureauinvestigates.com/2011/08/10/obama-2010-strikes/	13-15 killed including 'foreigners' in Datta Khel, North Waziristan.	Ob97	0	Possible	Pakistan	2010-06-11	13-15	15	13	12	32.99628265	North Waziristan	69.65615273	[]	12 hours later, another 3 missiles struck a house in Datta Khel, killing 11 people.	152		Maizer	279644211249283072	3
152	55c79e721cbee48856a3091e	[]	http://www.thebureauinvestigates.com/2011/08/10/obama-2010-strikes/	Named al Qaeda commander among 16-17 alleged militants killed in Soheel, Mir Ali, North Waziristan.	Ob98	0	0	Pakistan	2010-06-19	16-17	17	16	18	32.9700756	North Waziristan	70.31078339	[]	A missile, suspected to have been fired by an unmanned US drone, is reported to have killed 13 people and wounded 7 others.	153		Haider Khel	279664281400782849	3
153	55c79e721cbee48856a3091f	[]	http://www.thebureauinvestigates.com/2011/08/10/obama-2010-strikes/	2-4 killed in attack on house in Khushali Khel, North Waziristan.	Ob99	0	Unknown	Pakistan	2010-06-26	2-4	4	2	3	32.96863543	North Waziristan	70.35301208	[]	A US drone killed 4 people in a house near Miranshah.	154		Khushali	279665152566124544	1
154	55c79e721cbee48856a30920	[]	http://www.thebureauinvestigates.com/2011/08/10/obama-2010-strikes/	Six killed, including possible named Taliban commander, in Tappi Torkhel, North Waziristan.	Ob100	0	Unknown	Pakistan	2010-06-27	6	6	6	4	32.99973794	North Waziristan	70.1902771	[]	A US drone attack killed 6 people Sunday when missiles hit a house in Tabbi Torkhel.	155		Tabbi	279666336723001345	1
155	55c79e721cbee48856a30921	[]	http://www.thebureauinvestigates.com/2011/08/10/obama-2010-strikes/	Named militant among 7-10 killed in attack on Karikot, South Waziristan.	Ob101	0	Unknown	Pakistan	2010-06-29	7-10	10	7	4	32.31760259	South Waziristan	69.50054169	[]	8 people were killed in a drone strike Tuesday when 2 missiles destroyed a house in Karikot.	156	Maulvi Nazir?	Kari Kot	279669023455727616	1
156	55c79e721cbee48856a30922	[]	http://www.thebureauinvestigates.com/2011/08/10/obama-2010-strikes/	10-14 killed, including up to 7 civilians, in attack on house in Sheerani, North Waziristan	Ob102	0	4-7	Pakistan	2010-07-15	10-14	14	10	0	32.994267	North Waziristan	69.77253914	[]	A US drone killed 7. Elders in the area said many 'were civilians staying in a village house.'	157		Sheerani	279671775682523137	0
157	55c79e721cbee48856a30923	[]	http://www.thebureauinvestigates.com/2011/08/10/obama-2010-strikes/	16-18 alleged militants killed in attack on compound in Dwasarak, South Waziristan.	Ob103	0	Unknown	Pakistan	2010-07-24	16-18	18	16	24	32.44923085	South Waziristan	69.27858353	[]	16 people were killed by US drones when 4 missiles hit a house in Angoor Ada.	158		Dwasarak	279674650898886656	4
158	55c79e721cbee48856a30924	[]	http://www.thebureauinvestigates.com/2011/08/10/obama-2010-strikes/	14 alleged militants killed in Shaktoi, South Waziristan.	Ob104	0	0	Pakistan	2010-07-25	14	14	14	7	32.66539062	North Waziristan	70.16143799	[]	4 people died when a US drone hit their vehicle. 5 people in a nearby house were injured.	159		Shaktoi	279683329681403906	2
159	55c79e721cbee48856a30925	[]	http://www.thebureauinvestigates.com/2011/08/10/obama-2010-strikes/	Attack kills 4-7 alleged Haqqani militants in Tabbi, North Waziristan.	Ob105	0	0	Pakistan	2010-07-25	4-7	7	4	4	32.99973794	North Waziristan	70.1902771	[]	Later in the day, 2 missiles hit a house in Tabbi Tolkhel, killing 7 people.	160		Tabbi	279683395452297216	1
160	55c79e721cbee48856a30926	[]	http://www.thebureauinvestigates.com/2011/08/10/obama-2010-strikes/	Four alleged TTP militants killed in Landikhel, South Waziristan.	Ob106	0	0	Pakistan	2010-07-25	4	4	4	5	32.48891359	South Waziristan	70.00282288	[]	The weekend death count rose to 35. Four people perished in Srarogha.	161		Sararogha	279683467384602625	1
161	55c79e721cbee48856a30927	[]	http://www.thebureauinvestigates.com/2011/08/10/obama-2010-strikes/	Named Taliban commander killed with 13 others in strike on Issori, North Waziristan.	Ob107	0	7	Pakistan	2010-08-14	14	14	14	6	32.98922767	North Waziristan	70.29808044	[]	26-year-old Sohrab, who was leading evening prayers during Ramadan, was killed with 13 others.	162		Issori	279699585646088192	2
162	55c79e721cbee48856a30928	[]	http://www.thebureauinvestigates.com/2011/08/10/obama-2010-strikes/	4-6 killed, possibly including civilians, in attack on car in Kutabkhel, North Waziristan.	Ob108	0	0-4	Pakistan	2010-08-21	4-6	6	4	2	32.98418805	North Waziristan	70.07663727	[]	4 missiles hit 2 cars. 6 died. 4 drones were said to be hovering in the area for about an hour.	163		Qutab Khel	279705362570035200	1
163	55c79e721cbee48856a30929	[]	http://www.thebureauinvestigates.com/2011/08/10/obama-2010-strikes/	20 killed including 10 civilians in strike that supposedly led to change in CIA tactics. Darga Mandi, North Waziristan.	Ob109	3	10	Pakistan	2010-08-23	20	20	20	15	33.020179	North Waziristan	70.07286072	[]	3 children became orphans. Their father, Bismullah. Their mother. Their brothers. All killed.	164		Danda Darpakhel	279710130851938304	3
164	55c79e721cbee48856a3092a	[]	http://www.thebureauinvestigates.com/2011/08/10/obama-2010-strikes/	5-7 killed in attack on compound in Derga Mandai, North Waziristan.	Ob110	0	0-5	Pakistan	2010-08-23	5-7	7	5	12	33.04694673	North Waziristan	70.02033234	[]	A second drone attack killed 5 people Monday.	165		Darga Mandi	280334970462015488	3
165	55c79e721cbee48856a3092b	[]	http://www.thebureauinvestigates.com/2011/08/10/obama-2010-strikes/	Nine alleged militants killed in attack on trucks in Kurram Agency.	Ob111	0	0	Pakistan	2010-08-27	9	9	9	2	33.68092542	Kurram Agency	70.41687012	[]	4 people were killed when a US drone fired 4 missiles, hitting 2 vehicles near a house.	166		Shahidano	280495824557989889	1
166	55c79e721cbee48856a3092c	[]	http://www.thebureauinvestigates.com/2011/08/10/obama-2010-strikes/	A strike destroyed a residential compound. No casualty figures are available. Badshah Kot, Kurram Agency	Ob112	0	Unknown	Pakistan	2010-08-27	Unknown	0	0	0	33.47526759	Kurram Agency	70.38837433	[]	Barely two minutes later, another missile struck a residence in Badshah Kot.	167		Badshah Kot	280507243609350144	0
167	55c79e721cbee48856a3092d	[]	http://www.thebureauinvestigates.com/2011/08/10/obama-2010-strikes/	Three alleged miltants killed in attack on house in Taaloo Ganj, Kurram Agency.	Ob113	0	0	Pakistan	2010-08-27	3	3	3	0	33.68778176	Kurram Agency	70.54870605	[]	In the third attack in Kurram, around 11:35pm, 3 people died when a missile hit a mosque.	168		Taaloo Ganj	280507429828038656	0
168	55c79e721cbee48856a3092e	[]	http://www.thebureauinvestigates.com/2011/08/10/obama-2010-strikes/	6-9 alleged militants killed in attack on house in Miranshah, North Waziristan.	Ob114	0	0	Pakistan	2010-09-03	6-9	9	6	3	33.0020414	North Waziristan	70.06084442	[]	A drone fired 2 missiles on a house in the village of Machus, killing 6 people and injuring 3 others.	169		Miranshah	280726507134017538	1
169	55c79e721cbee48856a3092f	[]	http://www.thebureauinvestigates.com/2011/08/10/obama-2010-strikes/	2-4 killed in strike in Datta Khel, North Waziristan.	Ob115	0	0	Pakistan	2010-09-03	2-4	4	2	2	33.151242	North Waziristan	70.434707	[]	In the second strike of the day, 3 people were killed when 4 missiles hit a house during Iftar.	170		Datta Khel	280726584632176640	1
170	55c79e721cbee48856a30930	[]	http://www.thebureauinvestigates.com/2011/08/10/obama-2010-strikes/	Eight alleged militants killed in attack on vehicle in Datta Khel, North Waziristan.	Ob116	0	0	Pakistan	2010-09-04	8	8	8	12	33.151242	North Waziristan	70.434707	[]	A US drone fired 4 missiles on a house, killing 8 people and wounding 12.	171		Datta Khel	280728242443395072	3
171	55c79e721cbee48856a30931	[]	http://www.thebureauinvestigates.com/2011/08/10/obama-2010-strikes/	Six alleged militants were killed in an attack on a car. Khar Qamar area of North Waziristan.	Ob117	0	0	Pakistan	2010-09-06	6	6	6	0	32.97266785	North Waziristan	69.71237183	[]	Two missiles were fired on a vehicle Monday, killing 5 people in the village of Khar Qamar.	172		Khar Qamar	280729749398122498	0
172	55c79e721cbee48856a30932	[]	http://www.thebureauinvestigates.com/2011/08/10/obama-2010-strikes/	Four children and 6 alleged militants killed in attack on houses in Danda Darpakhel, North Waziristan.	Ob118	4	4	Pakistan	2010-09-08	10	10	10	2	33.020179	North Waziristan	70.07286072	[]	4 children were reported killed when missiles hit a house. US official: no civilians killed since May.	173		Danda Darpakhel	280734955057848321	1
173	55c79e721cbee48856a30933	[]	http://www.thebureauinvestigates.com/2011/08/10/obama-2010-strikes/	Four alleged militants killed in strike on car in Ambar Shaga, North Waziristan.	Ob119	0	0-4	Pakistan	2010-09-08	4	4	4	1	33.00146554	North Waziristan	69.52835083	[]	A US drone fired 2 missiles at a vehicle in Angoor Ada, killing 4 people.	174		Ambar Shaga	281251587299618817	1
174	55c79e721cbee48856a30934	[]	http://www.thebureauinvestigates.com/2011/08/10/obama-2010-strikes/	Two named militants, including a Briton and Uzbek, killed with at least eight others in strike on compound in Danda Darpakhel, North Waziristan.	Ob120	0	0	Pakistan	2010-09-08	10	10	10	5	33.020179	North Waziristan	70.07286072	[]	6 people were killed in the 3rd attack of the day.	175		Danda Darpakhel	281251743642288128	1
175	55c79e721cbee48856a30935	[]	http://www.thebureauinvestigates.com/2011/08/10/obama-2010-strikes/	Six alleged militants killed in attack on house in Miranshah, North Waziristan.	Ob121	0	0	Pakistan	2010-09-09	6	6	6	5	33.0020414	North Waziristan	70.06084442	[]	In the 4th attack in 24 hours, a US drone fired 2 missiles, killing 6 people and injuring 5 others.	176		Miranshah	281459152608428032	1
176	55c79e721cbee48856a30936	[]	http://www.thebureauinvestigates.com/2011/08/10/obama-2010-strikes/	5-7 alleged militants killed in attack on house in Newey Adda, North Waziristan.	Ob122	0	0	Pakistan	2010-09-12	5-7	7	5	2	32.98706787	North Waziristan	69.68730927	[]	At least 6 people were killed when a US drone fired 2 missiles at a house in Newey Adda.	177		Newey Adda	281459600480415744	1
177	55c79e721cbee48856a30937	[]	http://www.thebureauinvestigates.com/2011/08/10/obama-2010-strikes/	11-12 alleged Haqqani militants killed in strike on house in Bushnarai, North Waziristan.	Ob123	0	Unknown	Pakistan	2010-09-14	11-12	12	11	4	33.01845177	North Waziristan	69.65503693	[]	8 people died when missiles fired by a suspected US drone hit a house in Shawal.	178		Bushnarai	281460792744890369	1
178	55c79e721cbee48856a30938	[]	http://www.thebureauinvestigates.com/2011/08/10/obama-2010-strikes/	Saifullah Haqqani among four dead when car destroyed in Qutabkhel, North Waziristan.	Ob124	0	0	Pakistan	2010-09-14	4	4	4	0	32.98418805	North Waziristan	70.07663727	[]	4 people were killed when 2 missiles hit a vehicle in Qutab Khel.	179		Qutab Khel	281462361422974976	0
179	55c79e721cbee48856a30939	[]	http://www.thebureauinvestigates.com/2011/08/10/obama-2010-strikes/	Up to 15 killed including civilian rescuers in attack on alleged militant compound in Dargha Mandi, North Waziristan.	Ob125	0	5	Pakistan	2010-09-15	12-15	15	12	5	33.04694673	North Waziristan	70.02033234	[]	Several' US drones killed 11 people, among them Yahya, Samin, Niamatullah, Shahzad and Ilyas, all rescuers.	180		Darga Mandi	281468486981668865	1
180	55c79e721cbee48856a3093a	[]	http://www.thebureauinvestigates.com/2011/08/10/obama-2010-strikes/	5-7 alleged militants killed in strike on housing compound in Payakhel, North Waziristan.	Ob126	0	Unknown	Pakistan	2010-09-15	5-7	7	5	3	32.97756412	North Waziristan	69.64164734	[]	In the evening, US drones carried out a second attack, killing 7 people at a house in Datta Khel.	181		Pai Khel	281474077728841728	1
181	55c79e721cbee48856a3093b	[]	http://www.thebureauinvestigates.com/2011/08/10/obama-2010-strikes/	4 alleged Haqqani militants killed and possibly 5 civilians in strike in Deghan, Datta Khel, North Waziristan.	Ob127	0	5	Pakistan	2010-09-19	4-9	9	4	0	32.96863543	North Waziristan	69.70207214	[]	A US drone attack killed 4 people Sunday when 2 missiles hit a vehicle in Dehgan.	182		Deegan	281478925593497600	0
182	55c79e721cbee48856a3093c	[]	http://www.thebureauinvestigates.com/2011/08/10/obama-2010-strikes/	Six killed including up to three civilians in a a strike on a motorbike and rescuers.	Ob128	0	0-3	Pakistan	2010-09-20	6	6	6	0	33.06651369	North Waziristan	69.70104218	[]	Missiles were fired at 2 people on motorcycles. 2 more were fired as others rushed toward them.	183		Darazinda	281486973917593600	0
183	55c79e721cbee48856a3093d	[]	http://www.thebureauinvestigates.com/2011/08/10/obama-2010-strikes/	7-8 alleged militants killed in attack on car in Khand Morsak, South Waziristan.	Ob129	0	Unknown	Pakistan	2010-09-21	7-8	8	7	5	32.46429497	South Waziristan	69.29729462	[]	At least 7 people were killed in a US drone attack near Angor Adda.	184	Maulvi Nazir	Khand Morsak	281495313217359874	1
184	55c79e721cbee48856a3093e	[]	http://www.thebureauinvestigates.com/2011/08/10/obama-2010-strikes/	Failed attack on militant leader (possibly at funeral) kills 16 in Azam Warsak, South Waziristan.	Ob130	0	0	Pakistan	2010-09-21	16	16	16	0	32.30222379	South Waziristan	69.40544128	[]	6 people were killed and 5 others wounded when a US drone fired 3 missiles in Azam Warsak.	185	Maulvi Nazir	Azam Warsak	281495379462197250	0
